{
  "acceptance_rule": "Every corpus byte hash must match, every JSON canonical hash (where defined) must match, every semantic assertion must match, and incomplete historical records must retain their original authority classification.",
  "assertions": [
    {
      "equals": "PASS",
      "file": "METADATA/SCIENTIFIC_TEST_ORACLE_RESULT.json",
      "pointer": "/status"
    },
    {
      "equals": 36,
      "file": "METADATA/SCIENTIFIC_TEST_ORACLE_RESULT.json",
      "pointer": "/tests_total"
    },
    {
      "equals": 36,
      "file": "METADATA/SCIENTIFIC_TEST_ORACLE_RESULT.json",
      "pointer": "/tests_passed"
    },
    {
      "equals": 0,
      "file": "METADATA/SCIENTIFIC_TEST_ORACLE_RESULT.json",
      "pointer": "/tests_failed"
    },
    {
      "equals": "PASS",
      "file": "METADATA/DETERMINISM_MATRIX_RESULT.json",
      "pointer": "/status"
    },
    {
      "equals": 6,
      "file": "METADATA/DETERMINISM_MATRIX_RESULT.json",
      "pointer": "/variant_count"
    },
    {
      "equals": "726ee683d13a3e6ddc9437cd2df53c94a6f92caffd0f908fe5866d45bb06cd6e",
      "file": "METADATA/DETERMINISM_MATRIX_RESULT.json",
      "pointer": "/unique_science_sha256/0"
    },
    {
      "equals": "PASS",
      "file": "METADATA/O1_O7_PRIMARY_ORACLE.json",
      "pointer": "/status"
    },
    {
      "equals": "726ee683d13a3e6ddc9437cd2df53c94a6f92caffd0f908fe5866d45bb06cd6e",
      "file": "METADATA/O1_O7_PRIMARY_ORACLE.json",
      "pointer": "/levels/0/science_sha256"
    },
    {
      "equals": "d138de3c6c906be3ab453c225ecce2e3fff5d3e4f91d220ed681ef5253a86bbb",
      "file": "METADATA/O1_O7_PRIMARY_ORACLE.json",
      "pointer": "/levels/1/science_sha256"
    },
    {
      "equals": "92b5f72bdc1244292667383c326ca4f09f5752a86a94062802fd46c2c6c3053d",
      "file": "METADATA/O1_O7_PRIMARY_ORACLE.json",
      "pointer": "/levels/2/science_sha256"
    },
    {
      "equals": "ae3e2bb4b1cd29bd49c948d282f909e1c8adde85da15b8d1b6320a47294a2baf",
      "file": "METADATA/O1_O7_PRIMARY_ORACLE.json",
      "pointer": "/levels/3/science_sha256"
    },
    {
      "equals": "505c3deea7f987421d2c432086f7b65f0ef3072bdbd90eeaf1d8e8481689d166",
      "file": "METADATA/O1_O7_PRIMARY_ORACLE.json",
      "pointer": "/levels/4/science_sha256"
    },
    {
      "equals": "7b9e3ec0fbabcdb0fa46c2d5d153ac186cdd2d2343275a407e82b6fd14d9da37",
      "file": "METADATA/O1_O7_PRIMARY_ORACLE.json",
      "pointer": "/levels/5/science_sha256"
    },
    {
      "equals": "a3e0bed91b9e68edd4d7c9f508587d6801f9651b0485c6ce40e8ca284ffc2d90",
      "file": "METADATA/O1_O7_PRIMARY_ORACLE.json",
      "pointer": "/levels/6/science_sha256"
    },
    {
      "equals": "PASS",
      "file": "L2_CANONICAL_FINAL/07_RESULTS_SUMMARY/ig_rm1_L2_bijection_independence_results.json",
      "pointer": "/result"
    },
    {
      "equals": 120,
      "file": "L2_CANONICAL_FINAL/07_RESULTS_SUMMARY/ig_rm1_L2_bijection_independence_results.json",
      "pointer": "/automorphism_context_checks"
    },
    {
      "equals": 15,
      "file": "L2_CANONICAL_FINAL/07_RESULTS_SUMMARY/ig_rm1_L2_bijection_independence_results.json",
      "pointer": "/attachment_contexts"
    },
    {
      "equals": "NO_SEPARATING_CONTEXT_FOUND",
      "file": "L2_CANONICAL_FINAL/07_RESULTS_SUMMARY/ig_rm1_L2_direct_completeness_kill_test_results.json",
      "pointer": "/result"
    },
    {
      "equals": 833424,
      "file": "L2_CANONICAL_FINAL/07_RESULTS_SUMMARY/ig_rm1_L2_direct_completeness_kill_test_results.json",
      "pointer": "/stage1/admissible_contexts"
    },
    {
      "equals": 3936600,
      "file": "L2_CANONICAL_FINAL/07_RESULTS_SUMMARY/ig_rm1_L2_direct_completeness_kill_test_results.json",
      "pointer": "/stage2/admissible_depth2_contexts"
    },
    {
      "equals": true,
      "file": "L2_CANONICAL_FINAL/07_RESULTS_SUMMARY/ig_rm1_L2_isomorphism_reverification_all4_results.json",
      "pointer": "/all_four_pass"
    },
    {
      "equals": true,
      "file": "L2_CANONICAL_FINAL/07_RESULTS_SUMMARY/ig_rm1_L2_next_probe_all_small_rooted_contexts_results.json",
      "pointer": "/all_exact"
    },
    {
      "equals": 11,
      "file": "L2_CANONICAL_FINAL/07_RESULTS_SUMMARY/ig_rm1_L2_next_probe_all_small_rooted_contexts_results.json",
      "pointer": "/cases"
    },
    {
      "equals": true,
      "file": "L2_CANONICAL_FINAL/07_RESULTS_SUMMARY/ig_rm1_L2_next_probe_macro_macro_non2_obstruction_results.json",
      "pointer": "/all_500_exact_selected_sets_equal_by_relation_congruence"
    },
    {
      "equals": true,
      "file": "L2_CANONICAL_FINAL/07_RESULTS_SUMMARY/ig_rm1_L2_next_probe_macro_macro_non2_obstruction_results.json",
      "pointer": "/all_500_independent_maxima_agree"
    },
    {
      "equals": "PASS",
      "file": "L2_CANONICAL_FINAL/07_RESULTS_SUMMARY/ig_rm1_L2_recursive_completeness_constructor_audit_results.json",
      "pointer": "/result"
    },
    {
      "equals": true,
      "file": "L2_CANONICAL_FINAL/07_RESULTS_SUMMARY/ig_rm1_L2_step19_exact_set_compare_results.json",
      "pointer": "/exact_set_equal"
    },
    {
      "equals": 1966080,
      "file": "L2_CANONICAL_FINAL/07_RESULTS_SUMMARY/ig_rm1_L2_step19_exact_set_compare_results.json",
      "pointer": "/raw_count"
    },
    {
      "equals": 1966080,
      "file": "L2_CANONICAL_FINAL/07_RESULTS_SUMMARY/ig_rm1_L2_step19_exact_set_compare_results.json",
      "pointer": "/macro_count"
    }
  ],
  "baseline": {
    "archive_sha256": "0412a490488c785f2c7846e953f9316a4d2ccfd9b12cc5d72327c6440eb4b45f",
    "decoder_version": "0.26.0",
    "executable_source_sha256": "71d13cec323def599e0489a41068bba75d4569ae4b104234c66f2a51383c1369",
    "gate1_decoder_version": "0.26.1",
    "gate1_source_sha256": "bada049f4e26ac3165ec4aadba3d7d258ac5e4fbfd84befa128b82b6807a5f39"
  },
  "corpus_files": [
    {
      "canonical_sha256": null,
      "path": "CALIBRATION_AND_PERFORMANCE/Infinity_Grid_EXACT_CARRIER_CALIBRATION_O7_O9_RUNNING_RESCUE_2026-08-30.zip",
      "sha256": "e572fe32508a59e0844e2e8d4b70e658f8c774aef40f115942b3c632f4347bf7",
      "size_bytes": 4210
    },
    {
      "canonical_sha256": null,
      "path": "CALIBRATION_AND_PERFORMANCE/Infinity_Grid_EXACT_CARRIER_PERFORMANCE_AUDIT_v1_2026-08-30.zip",
      "sha256": "6113a7228ec839ce7314ad2925005f3a708cfb2672b2a5d0115c4ee5e06f76ee",
      "size_bytes": 33207
    },
    {
      "canonical_sha256": null,
      "path": "CALIBRATION_AND_PERFORMANCE/Infinity_Grid_O_REGIME_PERFORMANCE_AUDIT_v2_2026-08-30.zip",
      "sha256": "d3f4d48f765ccb7bb75e6cf18f67f5bc3810372d87788f75c726d50c3be96588",
      "size_bytes": 34361
    },
    {
      "canonical_sha256": "77f984562a9b45cba062d67e8efc38c6fdd9a5828894c9b6ec4854142fad3d9a",
      "path": "L2_CANONICAL_FINAL/07_RESULTS_SUMMARY/ig_rm1_L2_bijection_independence_results.json",
      "sha256": "fdc5bcafec7a17655d683ad36934a3721176b83956c4cbd768f5294959915639",
      "size_bytes": 6891
    },
    {
      "canonical_sha256": "f8f06849bba1a9e68b77317782fb3ecc47cfa7edbe502697d712a8447318b757",
      "path": "L2_CANONICAL_FINAL/07_RESULTS_SUMMARY/ig_rm1_L2_direct_completeness_kill_test_results.json",
      "sha256": "6d20f06dbea45c86913be6c009d8f647c6e3900cf34ec3ebc411b6b8ba6f7811",
      "size_bytes": 1438
    },
    {
      "canonical_sha256": "14e655cf21ab37101f252a97db461472b502e5b5c1a7a5e5c0261a012a4f124d",
      "path": "L2_CANONICAL_FINAL/07_RESULTS_SUMMARY/ig_rm1_L2_isomorphism_reverification_all4_results.json",
      "sha256": "5a344c997d610d00acffb277fa2e7b46ca4250fa5c0b4e86e02223ee63457804",
      "size_bytes": 2898
    },
    {
      "canonical_sha256": "f1e48570b5763c6ff16bd091a992db0151ccd65b16614fecc6405a78f5ccaba8",
      "path": "L2_CANONICAL_FINAL/07_RESULTS_SUMMARY/ig_rm1_L2_next_probe_all_small_rooted_contexts_results.json",
      "sha256": "c06e1ec388b9f4e09ddf9ccce37353f1a17d79ef997272b30c797d0e1f05e3c0",
      "size_bytes": 11460
    },
    {
      "canonical_sha256": "39ab82487ba001a7e14dcf5a992db2d2715a4d5f60dc724b2f82091e295652a1",
      "path": "L2_CANONICAL_FINAL/07_RESULTS_SUMMARY/ig_rm1_L2_next_probe_macro_macro_non2_obstruction_results.json",
      "sha256": "adb4ebb5eaf2d709b76b7b6a3b9a916b6544a3dce0ddc0d28e69e6e3553e7259",
      "size_bytes": 722474
    },
    {
      "canonical_sha256": "afa45245cf87f4bcb3f373ef6ef55b3349f083f01ca6fd6a23d976f5e8772137",
      "path": "L2_CANONICAL_FINAL/07_RESULTS_SUMMARY/ig_rm1_L2_recursive_completeness_constructor_audit_results.json",
      "sha256": "60d631acac0c4ac0d8c4fac9b7463029f4ae1b26ded17c8c11bff5fdada166b5",
      "size_bytes": 1361
    },
    {
      "canonical_sha256": "5bbbce9f68395d63fe03839b326d0259431f0a56bf40a8f01be0c370c373dff2",
      "path": "L2_CANONICAL_FINAL/07_RESULTS_SUMMARY/ig_rm1_L2_step19_exact_set_compare_results.json",
      "sha256": "702c0d879374b578c996e89b258a1761cfb22a8bf96f7b37162301021128c4ac",
      "size_bytes": 115
    },
    {
      "canonical_sha256": null,
      "path": "L2_CANONICAL_FINAL/Infinity_Grid_Algebra_Final_2026-08-15.zip",
      "sha256": "1a65bf05d8df6b8ec64ba42810ddab4b17f858320f78b0d0fcf8b6707f3861d2",
      "size_bytes": 150581
    },
    {
      "canonical_sha256": "d09a624ca3658fd1768d52d3f315c6e1af731ea77c03a413c570503dac0ef1cf",
      "path": "METADATA/CALIBRATION_RECORD_INDEX.json",
      "sha256": "4960a86f78917eb36eb7ccb6e5a56d1c5b048f0ee16a486b3d2ae9c969647513",
      "size_bytes": 2339
    },
    {
      "canonical_sha256": "59c364cc968f87a93561f2e728083bae54ee4941e60a0ddc85752474a0a074cb",
      "path": "METADATA/DETERMINISM_MATRIX_RESULT.json",
      "sha256": "ca3c9c24096ee28d458a4c5865857a6b662014775aa8ea2b9e2edd1e1adc44ff",
      "size_bytes": 3245
    },
    {
      "canonical_sha256": "269b6483c3a0bb9b346123db259f41bcc3858f680de3d0b39b8f7968a4d071e5",
      "path": "METADATA/L2_ORACLE_INDEX.json",
      "sha256": "16b1f656c19b449c530bd2ea9f887fb0ee816fb85c8e29e2dca5783c3c5e7b28",
      "size_bytes": 5173
    },
    {